### ISSUE TITLE
not receiving continuation frame from websocket-sharp

### ISSUE THREAD

**Issue by KosmoGalaxy** [becvert/cordova-plugin-websocket-server#29]
Hello,
I have been using this plugin in version 1.1.3 with websocket-sharp with no problems.
But the newest version cannot handle split messages. I am using WireShark to see what is being sent and here is what is being sent from client to server but does not arrive.

WebSocket Text  [MASKED]

Frame 347: 1078 bytes on wire (8624 bits), 1078 bytes captured (8624 bits) on interface 0
    Interface id: 0 (\Device\NPF_{AC7CCEA0-9135-4E5E-AC9C-8461828E6F6B})
    Encapsulation type: Ethernet (1)
    Arrival Time: Apr 12, 2017 18:59:41.034495000 Central European Daylight Time
    [Time shift for this packet: 0.000000000 seconds]
    Epoch Time: 1492016381.034495000 seconds
    [Time delta from previous captured frame: 0.015473000 seconds]
    [Time delta from previous displayed frame: 0.020017000 seconds]
    [Time since reference or first frame: 36.122217000 seconds]
    Frame Number: 347
    Frame Length: 1078 bytes (8624 bits)
    Capture Length: 1078 bytes (8624 bits)
    [Frame is marked: False]
    [Frame is ignored: False]
    [Protocols in frame: eth:ethertype:ip:tcp:http:websocket:data-text-lines]
    [Coloring Rule Name: TCP]
    [Coloring Rule String: tcp]
Ethernet II, Src: AsrockIn_34:25:35 (bc:5f:f4:34:25:35), Dst: Routerbo_0f:ef:3f (6c:3b:6b:0f:ef:3f)
Internet Protocol Version 4, Src: 10.10.112.22, Dst: 10.10.112.6
Transmission Control Protocol, Src Port: 51788, Dst Port: 53743, Seq: 278, Ack: 181, Len: 1024
    Source Port: 51788
    Destination Port: 53743
    [Stream index: 16]
    [TCP Segment Len: 1024]
    Sequence number: 278    (relative sequence number)
    [Next sequence number: 1302    (relative sequence number)]
    Acknowledgment number: 181    (relative ack number)
    Header Length: 20 bytes
    Flags: 0x018 (PSH, ACK)
    Window size value: 255
    [Calculated window size: 65280]
    [Window size scaling factor: 256]
    Checksum: 0xf84a [unverified]
    [Checksum Status: Unverified]
    Urgent pointer: 0
    [SEQ/ACK analysis]
        [This is an ACK to the segment in frame: 345]
        [The RTT to ACK the segment was: 0.020017000 seconds]
        [iRTT: 0.115772000 seconds]
        [Bytes in flight: 1024]
        [Bytes sent since last PSH flag: 1024]
    [PDU Size: 1024]
WebSocket
    0... .... = Fin: False
    .000 .... = Reserved: 0x0
    .... 0001 = Opcode: Text (1)
    1... .... = Mask: True
    .111 1110 = Payload length: 126 Extended Payload Length (16 bits)
    Extended Payload length (16 bits): 1016
    Masking-Key: 9e39dfb2
    Masked payload
    Payload
Line-based text data
     [truncated]{"code":1,"data":"{\"id\":\"3d63815f4e130a632449cfb23ff10405d9e69901\",\"nr\":7,\"name\":\"My Deviceaaaaaaaaaaaaaaaaaaaaaaaaaaaaaaaaaaaaaaaaaaaaaaaaaaaaaaaaaaaaaaaaaaaaaaaaaaaaaaaaaaaaaaaaaaaaaaaaaaaaaaaaaaaaaaaaaaaaaaaaaaaaaaa

WebSocket Continuation [FIN] [MASKED]

Frame 348: 2023 bytes on wire (16184 bits), 2023 bytes captured (16184 bits) on interface 0
    Interface id: 0 (\Device\NPF_{AC7CCEA0-9135-4E5E-AC9C-8461828E6F6B})
    Encapsulation type: Ethernet (1)
    Arrival Time: Apr 12, 2017 18:59:41.034584000 Central European Daylight Time
    [Time shift for this packet: 0.000000000 seconds]
    Epoch Time: 1492016381.034584000 seconds
    [Time delta from previous captured frame: 0.000089000 seconds]
    [Time delta from previous displayed frame: 0.000089000 seconds]
    [Time since reference or first frame: 36.122306000 seconds]
    Frame Number: 348
    Frame Length: 2023 bytes (16184 bits)
    Capture Length: 2023 bytes (16184 bits)
    [Frame is marked: False]
    [Frame is ignored: False]
    [Protocols in frame: eth:ethertype:ip:tcp:http:websocket]
    [Coloring Rule Name: TCP]
    [Coloring Rule String: tcp]
Ethernet II, Src: AsrockIn_34:25:35 (bc:5f:f4:34:25:35), Dst: Routerbo_0f:ef:3f (6c:3b:6b:0f:ef:3f)
Internet Protocol Version 4, Src: 10.10.112.22, Dst: 10.10.112.6
Transmission Control Protocol, Src Port: 51788, Dst Port: 53743, Seq: 1302, Ack: 181, Len: 1969
    Source Port: 51788
    Destination Port: 53743
    [Stream index: 16]
    [TCP Segment Len: 1969]
    Sequence number: 1302    (relative sequence number)
    [Next sequence number: 3271    (relative sequence number)]
    Acknowledgment number: 181    (relative ack number)
    Header Length: 20 bytes
    Flags: 0x018 (PSH, ACK)
    Window size value: 255
    [Calculated window size: 65280]
    [Window size scaling factor: 256]
    Checksum: 0xf436 [unverified]
    [Checksum Status: Unverified]
    Urgent pointer: 0
    [SEQ/ACK analysis]
    [PDU Size: 1024]
    [PDU Size: 945]
WebSocket
    0... .... = Fin: False
    .000 .... = Reserved: 0x0
    .... 0000 = Opcode: Continuation (0)
    1... .... = Mask: True
    .111 1110 = Payload length: 126 Extended Payload Length (16 bits)
    Extended Payload length (16 bits): 1016
    Masking-Key: 117657bd
    Masked payload
    Payload
Continue: 616161616161616161616161616161616161616161616161...
WebSocket
    1... .... = Fin: True
    .000 .... = Reserved: 0x0
    .... 0000 = Opcode: Continuation (0)
    1... .... = Mask: True
    .111 1110 = Payload length: 126 Extended Payload Length (16 bits)
    Extended Payload length (16 bits): 937
    Masking-Key: 3da9ca8d
    Masked payload
    Payload
Continue: 344b2033363020425249444745204a554d50494e472e6d70...

**Comment by becvert** [comment]
running on Android or iOS?

**Comment by KosmoGalaxy** [comment]
Android 6

**Comment by becvert** [comment]
OK
Did you enable the tcpNoDelay option?

**Comment by KosmoGalaxy** [comment]
Yes, I did try this option, but noticed no difference.

**Comment by becvert** [comment]
OK
I'm planning to revert back the underlying library from com.pusher:java-websocket:1.4.1 to the original org.java-websocket:java-websocket:1.3.2
I'll prepare a branch for you to test sometime this week.

**Comment by KosmoGalaxy** [comment]
Ok, so here's the thing. It works with a different client side plugin.
But it worked with the previous version of this plugin.
So something changed in this plugin that doesn't work anymore with websocket-sharp, but it still works with other plugin.

**Comment by becvert** [comment]
Please test branch 1.4.3
Thank you

**Comment by becvert** [comment]
1.4.3 has been released

**Comment by KosmoGalaxy** [comment]
Ok, nice, I'm a bit busy right now though. :/

**Comment by becvert** [comment]
Closing for now. Feel free to reopen
